{
  "format_version": "2.0",
  "playbook": {
    "id": "post-loop-fix",
    "plan_path": "play/projects/design-validation/playbooks/post-loop-fix/plan.json",
    "status": "active"
  },
  "active": {
    "phase": "p_final",
    "subtask": "p_final.3"
  },
  "phases": {
    "p1": {
      "status": "done",
      "updated_at": "2026-01-07T18:00:00Z"
    },
    "p2": {
      "status": "done",
      "updated_at": "2026-01-07T18:10:00Z"
    },
    "p3": {
      "status": "done",
      "updated_at": "2026-01-07T18:15:00Z"
    },
    "p_final": {
      "status": "done",
      "updated_at": "2026-01-07T18:30:00Z"
    }
  },
  "subtasks": {
    "p1.1": {
      "status": "done",
      "validated_at": "2026-01-07T18:00:00Z",
      "validated_by": "claudecode",
      "validations": {
        "technical": {
          "status": "PASS",
          "evidence": ["archive-playbook.sh の exit パス 10+1 を列挙", "|| true で失敗無視を確認"]
        },
        "consistency": {
          "status": "PASS",
          "evidence": ["post-tool-edit/chain.sh:26 との連携を確認", "subagent-stop/chain.sh M089 との連携を確認"]
        },
        "completeness": {
          "status": "PASS",
          "evidence": ["exit 0 (10箇所), exit 2 (2箇所) を全て確認"]
        }
      },
      "notes": "失敗経路: SubAgent内Edit→PostToolUse未発火、|| true で失敗無視"
    },
    "p1.2": {
      "status": "done",
      "validated_at": "2026-01-07T18:00:00Z",
      "validated_by": "claudecode",
      "validations": {
        "technical": {
          "status": "PASS",
          "evidence": ["subagent-stop/chain.sh:35-36 に明記あり"]
        },
        "consistency": {
          "status": "PASS",
          "evidence": ["Claude Code 公式仕様と一致"]
        },
        "completeness": {
          "status": "PASS",
          "evidence": ["再現条件: SubAgent 内で Edit 実行"]
        }
      },
      "notes": "SubAgent内EditはPostToolUse:Edit Hookを発火させない（Claude Code仕様）"
    },
    "p1.3": {
      "status": "done",
      "validated_at": "2026-01-07T18:00:00Z",
      "validated_by": "claudecode",
      "validations": {
        "technical": {
          "status": "PASS",
          "evidence": ["Stop hook で pending チェックなし", "pending-guard.sh は PreToolUse のみ発火"]
        },
        "consistency": {
          "status": "PASS",
          "evidence": ["SKILL.md のフローと照合完了"]
        },
        "completeness": {
          "status": "PASS",
          "evidence": ["スキップ経路: Stop 実行時に pending チェックされない"]
        }
      },
      "notes": "根本原因: Stop hook で pending ファイルをチェックしていない"
    },
    "p2.1": {
      "status": "done",
      "validated_at": "2026-01-07T18:10:00Z",
      "validated_by": "codex",
      "validations": {
        "technical": {
          "status": "PASS",
          "evidence": ["bash -n でシンタックスチェック OK", "set +e/set -e でエラー伝播制御"]
        },
        "consistency": {
          "status": "PASS",
          "evidence": ["archive-playbook.sh との連携確認", "exit code 0/2/other の処理分岐"]
        },
        "completeness": {
          "status": "PASS",
          "evidence": ["SubAgent終了時のフローが完結（ログ記録含む）"]
        }
      },
      "notes": "|| true 削除、exit code に応じた処理分岐を追加"
    },
    "p2.2": {
      "status": "done",
      "validated_at": "2026-01-07T18:10:00Z",
      "validated_by": "codex",
      "validations": {
        "technical": {
          "status": "PASS",
          "evidence": ["log_debug 関数追加", ".claude/logs/archive-playbook.log に出力"]
        },
        "consistency": {
          "status": "PASS",
          "evidence": ["他スクリプトのエラー形式と統一（タイムスタンプ + メッセージ）"]
        },
        "completeness": {
          "status": "PASS",
          "evidence": ["全早期終了パス（10箇所）でログ出力追加"]
        }
      },
      "notes": "log_debug 関数追加、全早期終了箇所にログ出力"
    },
    "p3.1": {
      "status": "done",
      "validated_at": "2026-01-07T18:15:00Z",
      "validated_by": "codex",
      "validations": {
        "technical": {
          "status": "PASS",
          "evidence": ["bash -n シンタックスチェック OK", "pending チェックロジック追加"]
        },
        "consistency": {
          "status": "PASS",
          "evidence": ["pending-guard.sh と同じ main ブランチ例外ロジック"]
        },
        "completeness": {
          "status": "PASS",
          "evidence": ["Stop 時に pending チェック→BLOCK (exit 2)"]
        }
      },
      "notes": "Stop hook に pending ファイルチェックを追加。main ブランチ例外あり。"
    },
    "p3.2": {
      "status": "done",
      "validated_at": "2026-01-07T18:15:00Z",
      "validated_by": "claudecode",
      "validations": {
        "technical": {
          "status": "PASS",
          "evidence": ["pending-guard.sh の PreToolUse:Edit/Write 発火確認"]
        },
        "consistency": {
          "status": "PASS",
          "evidence": ["main ブランチ例外が正しく機能"]
        },
        "completeness": {
          "status": "PASS",
          "evidence": ["SubAgent終了後のEditはorchestrator経由→PreToolUse発火"]
        }
      },
      "notes": "SubAgent終了後もpending-guardは正常に機能（PreToolUse Hook経由）"
    },
    "p_final.1": {
      "status": "done",
      "validated_at": "2026-01-07T18:20:00Z",
      "validated_by": "claudecode",
      "validations": {
        "technical": {
          "status": "PASS",
          "evidence": ["フロー図を作成し各ステップを確認"]
        },
        "consistency": {
          "status": "PASS",
          "evidence": ["SKILL.md と実装が一致"]
        },
        "completeness": {
          "status": "PASS",
          "evidence": ["修正前後のフロー比較を文書化"]
        }
      },
      "notes": "修正後フロー: SubagentStop補完→archive→pending→Stop Block→post-loop強制"
    },
    "p_final.2": {
      "status": "done",
      "validated_at": "2026-01-07T18:20:00Z",
      "validated_by": "claudecode",
      "validations": {
        "technical": {
          "status": "PASS",
          "evidence": ["SKILL.md に Stop Hook ブロックを追記"]
        },
        "consistency": {
          "status": "PASS",
          "evidence": ["SubagentStop 経由の補完を記載"]
        },
        "completeness": {
          "status": "PASS",
          "evidence": ["デバッグログの場所を記載"]
        }
      },
      "notes": "SKILL.md に Stop Hook ブロックと SubagentStop 補完を追記"
    },
    "p_final.3": {
      "status": "done",
      "validated_at": "2026-01-07T18:30:00Z",
      "validated_by": "reviewer",
      "validations": {
        "technical": {
          "status": "PASS",
          "evidence": ["4QV+ 検証 PASS (5/5)", "全変更ファイルの実装検証完了"]
        },
        "consistency": {
          "status": "PASS",
          "evidence": ["playbook の scope と成果物の一致確認", "done_when と実装の照合完了"]
        },
        "completeness": {
          "status": "PASS",
          "evidence": ["全10 subtask の完了確認", "シミュレーションでフロー検証済み"]
        }
      },
      "notes": "reviewer 4QV+ PASS: 全 done_when 項目が実装によって満たされている"
    }
  },
  "final_tasks": [],
  "critic": {
    "status": "PASS",
    "evidence": [
      "done_when_1: archive-playbook.sh Step 1-12 実装 + subagent-stop M089 補完",
      "done_when_2: stop/chain.sh pending チェック追加 (exit 2)",
      "done_when_3: pending チェック + main ブランチ例外が pending-guard.sh と整合"
    ],
    "notes": "全 done_when 項目 PASS、全 10 subtask 完了、reviewer 4QV+ PASS"
  }
}
