{
  "format_version": "2.0",
  "playbook": {
    "id": "architecture-sync",
    "plan_path": "play/standalone/architecture-sync/plan.json",
    "status": "completed"
  },
  "active": {
    "phase": "p_final",
    "subtask": "p_final.1"
  },
  "phases": {
    "p1": {
      "status": "done",
      "updated_at": "2026-01-29T00:00:00Z"
    },
    "p_final": {
      "status": "done",
      "updated_at": "2026-01-29T00:00:00Z"
    }
  },
  "subtasks": {
    "p1.1": {
      "status": "done",
      "validated_at": "2026-01-29T00:00:00Z",
      "validated_by": "critic",
      "validations": {
        "technical": {
          "status": "PASS",
          "evidence": [
            "grep -A10 'crit/' confirms SKILL.md present in section 8"
          ]
        },
        "consistency": {
          "status": "PASS",
          "evidence": [
            "grep 'verify.sh' confirms handlers/verify.sh documented"
          ]
        },
        "completeness": {
          "status": "PASS",
          "evidence": [
            "Line ordering: understanding-check/ (1018) < crit/ (1025) < 8.5 (1036)"
          ]
        }
      },
      "notes": "All done_when conditions verified"
    },
    "p_final.1": {
      "status": "done",
      "validated_at": "2026-01-29T00:00:00Z",
      "validated_by": "critic",
      "validations": {
        "technical": {
          "status": "PASS",
          "evidence": []
        },
        "consistency": {
          "status": "PASS",
          "evidence": []
        },
        "completeness": {
          "status": "PASS",
          "evidence": []
        }
      },
      "notes": "Critic evaluation complete"
    }
  },
  "final_tasks": [],
  "critic": {
    "status": "PASS",
    "evidence": [
      "Condition 1: crit/ section exists with SKILL.md documented",
      "Condition 2: verify.sh is mentioned (1 match)",
      "Condition 3: Line order correct - understanding-check/ (1018) < crit/ (1025) < 8.5 (1036)"
    ],
    "notes": "All 3 done_when conditions verified by command execution"
  }
}
