{
  "format_version": "2.0",
  "playbook": {
    "id": "fix-archive-project-merge",
    "plan_path": "play/standalone/fix-archive-project-merge/plan.json",
    "status": "completed"
  },
  "active": {
    "phase": "p_final",
    "subtask": "p_final.1"
  },
  "phases": {
    "p1": {
      "status": "done",
      "updated_at": "2026-01-20T04:30:00+09:00"
    },
    "p2": {
      "status": "done",
      "updated_at": "2026-01-20T04:32:00+09:00"
    },
    "p_final": {
      "status": "done",
      "updated_at": "2026-01-20T04:35:00+09:00"
    }
  },
  "subtasks": {
    "p1.1": {
      "status": "done",
      "validated_at": "2026-01-20T04:30:00+09:00",
      "validated_by": "critic",
      "validations": {
        "technical": {
          "status": "PASS",
          "evidence": [
            "grep -A20: 117-132行目にマージロジック（mv退避・復元）実装"
          ]
        },
        "consistency": {
          "status": "PASS",
          "evidence": [
            "mv コマンド維持、既存 playbooks は退避後復元"
          ]
        },
        "completeness": {
          "status": "PASS",
          "evidence": [
            "rm -rf は playbooks 退避後に実行、データ消失なし"
          ]
        }
      },
      "notes": "mv による退避・復元方式でマージを実現"
    },
    "p2.1": {
      "status": "done",
      "validated_at": "2026-01-20T04:32:00+09:00",
      "validated_by": "critic",
      "validations": {
        "technical": {
          "status": "PASS",
          "evidence": [
            "bash -n exit code 0"
          ]
        },
        "consistency": {
          "status": "PASS",
          "evidence": [
            "set -e 使用、他スクリプトと同一スタイル"
          ]
        },
        "completeness": {
          "status": "PASS",
          "evidence": [
            "log_error + exit 1 パターンでエラーハンドリング実装"
          ]
        }
      },
      "notes": "構文チェック PASS"
    },
    "p_final.1": {
      "status": "done",
      "validated_at": "2026-01-20T04:35:00+09:00",
      "validated_by": "critic",
      "validations": {
        "technical": {
          "status": "PASS",
          "evidence": [
            "reviewer PASS 3/3 + critic 独立検証"
          ]
        },
        "consistency": {
          "status": "PASS",
          "evidence": [
            "done_when 全項目が実装と一致"
          ]
        },
        "completeness": {
          "status": "PASS",
          "evidence": [
            "backup-restore パターンで既存 playbooks 保護"
          ]
        }
      },
      "notes": "reviewer + critic dual validation 完了"
    }
  },
  "final_tasks": [],
  "critic": {
    "status": "PENDING",
    "evidence": [],
    "notes": ""
  }
}
