{
  "format_version": "2.0",
  "playbook": {
    "id": "v2-design-docs",
    "plan_path": "play/standalone/v2-design-docs/plan.json",
    "status": "active"
  },
  "active": {
    "phase": "p_final",
    "subtask": "p_final.1"
  },
  "phases": {
    "p1": {
      "status": "done",
      "updated_at": "2026-01-22T16:15:00Z"
    },
    "p2": {
      "status": "done",
      "updated_at": "2026-01-22T16:19:00Z"
    },
    "p_final": {
      "status": "done",
      "updated_at": "2026-01-22T16:20:00Z"
    }
  },
  "subtasks": {
    "p1.1": {
      "status": "pending",
      "validated_at": "",
      "validated_by": "",
      "validations": {
        "technical": {
          "status": "PENDING",
          "evidence": []
        },
        "consistency": {
          "status": "PENDING",
          "evidence": []
        },
        "completeness": {
          "status": "PENDING",
          "evidence": []
        }
      },
      "notes": ""
    },
    "p1.2": {
      "status": "pending",
      "validated_at": "",
      "validated_by": "",
      "validations": {
        "technical": {
          "status": "PENDING",
          "evidence": []
        },
        "consistency": {
          "status": "PENDING",
          "evidence": []
        },
        "completeness": {
          "status": "PENDING",
          "evidence": []
        }
      },
      "notes": ""
    },
    "p1.3": {
      "status": "pending",
      "validated_at": "",
      "validated_by": "",
      "validations": {
        "technical": {
          "status": "PENDING",
          "evidence": []
        },
        "consistency": {
          "status": "PENDING",
          "evidence": []
        },
        "completeness": {
          "status": "PENDING",
          "evidence": []
        }
      },
      "notes": ""
    },
    "p2.1": {
      "status": "pending",
      "validated_at": "",
      "validated_by": "",
      "validations": {
        "technical": {
          "status": "PENDING",
          "evidence": []
        },
        "consistency": {
          "status": "PENDING",
          "evidence": []
        },
        "completeness": {
          "status": "PENDING",
          "evidence": []
        }
      },
      "notes": ""
    },
    "p2.2": {
      "status": "pending",
      "validated_at": "",
      "validated_by": "",
      "validations": {
        "technical": {
          "status": "PENDING",
          "evidence": []
        },
        "consistency": {
          "status": "PENDING",
          "evidence": []
        },
        "completeness": {
          "status": "PENDING",
          "evidence": []
        }
      },
      "notes": ""
    },
    "p2.3": {
      "status": "pending",
      "validated_at": "",
      "validated_by": "",
      "validations": {
        "technical": {
          "status": "PENDING",
          "evidence": []
        },
        "consistency": {
          "status": "PENDING",
          "evidence": []
        },
        "completeness": {
          "status": "PENDING",
          "evidence": []
        }
      },
      "notes": ""
    },
    "p2.4": {
      "status": "pending",
      "validated_at": "",
      "validated_by": "",
      "validations": {
        "technical": {
          "status": "PENDING",
          "evidence": []
        },
        "consistency": {
          "status": "PENDING",
          "evidence": []
        },
        "completeness": {
          "status": "PENDING",
          "evidence": []
        }
      },
      "notes": ""
    },
    "p_final.1": {
      "status": "pending",
      "validated_at": "",
      "validated_by": "",
      "validations": {
        "technical": {
          "status": "PENDING",
          "evidence": []
        },
        "consistency": {
          "status": "PENDING",
          "evidence": []
        },
        "completeness": {
          "status": "PENDING",
          "evidence": []
        }
      },
      "notes": ""
    }
  },
  "final_tasks": [],
  "critic": {
    "status": "PENDING",
    "evidence": [],
    "notes": ""
  }
}
