{
  "format_version": "2.0",
  "playbook": {
    "id": "m3-cleanup",
    "plan_path": "play/projects/context-cleanup/playbooks/m3-cleanup/plan.json",
    "status": "active"
  },
  "active": {
    "phase": "p_final",
    "subtask": "p_final.1"
  },
  "phases": {
    "p1": { "status": "done", "updated_at": "2026-01-08T02:40:00+09:00" },
    "p2": { "status": "done", "updated_at": "2026-01-08T02:40:00+09:00" },
    "p3": { "status": "done", "updated_at": "2026-01-08T02:40:00+09:00" },
    "p_final": { "status": "done", "updated_at": "2026-01-08T03:00:00+09:00" }
  },
  "subtasks": {
    "p1.1": {
      "status": "done",
      "validated_at": "2026-01-08T02:40:00+09:00",
      "validated_by": "claudecode",
      "validations": {
        "technical": { "status": "PASS", "evidence": ["test ! -f .DS_Store = success"] },
        "consistency": { "status": "PASS", "evidence": ["grep '.DS_Store' .gitignore = found"] },
        "completeness": { "status": "PASS", "evidence": ["削除と再発防止の両方が完了"] }
      },
      "notes": ""
    },
    "p2.1": {
      "status": "done",
      "validated_at": "2026-01-08T02:40:00+09:00",
      "validated_by": "claudecode",
      "validations": {
        "technical": { "status": "PASS", "evidence": ["2026-01-05_*.md, 2026-01-06_*.md が存在しない"] },
        "consistency": { "status": "PASS", "evidence": ["12件のセッションログが保持されている"] },
        "completeness": { "status": "PASS", "evidence": ["14件が削除されている"] }
      },
      "notes": ""
    },
    "p3.1": {
      "status": "done",
      "validated_at": "2026-01-08T02:40:00+09:00",
      "validated_by": "claudecode",
      "validations": {
        "technical": { "status": "PASS", "evidence": ["test ! -f play/template/project.json = success"] },
        "consistency": { "status": "PASS", "evidence": ["play/projects/template/project.json は存在する"] },
        "completeness": { "status": "PASS", "evidence": ["legacy ファイルが削除されている"] }
      },
      "notes": ""
    },
    "p_final.1": {
      "status": "done",
      "validated_at": "2026-01-08T03:00:00+09:00",
      "validated_by": "critic",
      "validations": {
        "technical": { "status": "PASS", "evidence": ["test ! -f .DS_Store = success", "grep '.DS_Store' .gitignore = found", "ls 2026-01-0{5,6}_*.md = no matches", "test ! -f play/template/project.json = success"] },
        "consistency": { "status": "PASS", "evidence": ["新テンプレート play/projects/template/project.json 存在確認", "2026-01-07/08 のログは保持"] },
        "completeness": { "status": "PASS", "evidence": ["4件の done_when 全て達成"] }
      },
      "notes": "critic による最終検証完了"
    }
  },
  "final_tasks": [],
  "critic": { "status": "PENDING", "evidence": [], "notes": "" }
}
