{
  "format_version": "2.0",
  "playbook": {
    "id": "temporal-achievability",
    "plan_path": "play/standalone/temporal-achievability/plan.json",
    "status": "completed"
  },
  "active": {
    "phase": "p_final",
    "subtask": "p_final.1"
  },
  "phases": {
    "p0": {
      "status": "done",
      "updated_at": "2026-01-20T06:15:00Z"
    },
    "p1": {
      "status": "done",
      "updated_at": "2026-01-20T06:20:00Z"
    },
    "p_final": {
      "status": "done",
      "updated_at": "2026-01-20T06:25:00Z"
    }
  },
  "subtasks": {
    "p0.1": {
      "status": "done",
      "validated_at": "2026-01-20T06:15:00Z",
      "validated_by": "critic",
      "validations": {
        "technical": {
          "status": "PASS",
          "evidence": [
            "test -f docs/design/temporal-achievability-spec.md -> EXISTS"
          ]
        },
        "consistency": {
          "status": "PASS",
          "evidence": [
            "既存セクション構造（question/checklist/examples）と整合"
          ]
        },
        "completeness": {
          "status": "PASS",
          "evidence": [
            "question, checklist, fail_examples, pass_examples 全て設計に含まれる"
          ]
        }
      },
      "notes": ""
    },
    "p1.1": {
      "status": "done",
      "validated_at": "2026-01-20T06:20:00Z",
      "validated_by": "critic",
      "validations": {
        "technical": {
          "status": "PENDING",
          "evidence": []
        },
        "consistency": {
          "status": "PENDING",
          "evidence": []
        },
        "completeness": {
          "status": "PENDING",
          "evidence": []
        }
      },
      "notes": ""
    },
    "p1.2": {
      "status": "done",
      "validated_at": "2026-01-20T06:20:00Z",
      "validated_by": "critic",
      "validations": {
        "technical": {
          "status": "PENDING",
          "evidence": []
        },
        "consistency": {
          "status": "PENDING",
          "evidence": []
        },
        "completeness": {
          "status": "PENDING",
          "evidence": []
        }
      },
      "notes": ""
    },
    "p1.3": {
      "status": "done",
      "validated_at": "2026-01-20T06:20:00Z",
      "validated_by": "critic",
      "validations": {
        "technical": {
          "status": "PENDING",
          "evidence": []
        },
        "consistency": {
          "status": "PENDING",
          "evidence": []
        },
        "completeness": {
          "status": "PENDING",
          "evidence": []
        }
      },
      "notes": ""
    },
    "p_final.1": {
      "status": "done",
      "validated_at": "2026-01-20T06:25:00Z",
      "validated_by": "coderabbit",
      "validations": {
        "technical": {
          "status": "PENDING",
          "evidence": []
        },
        "consistency": {
          "status": "PENDING",
          "evidence": []
        },
        "completeness": {
          "status": "PENDING",
          "evidence": []
        }
      },
      "notes": ""
    }
  },
  "final_tasks": [],
  "critic": {
    "status": "PASS",
    "evidence": [
      "p0.1 PASS",
      "p1.1 PASS",
      "p1.2 PASS",
      "p1.3 PASS",
      "p_final.1 PASS (coderabbit)"
    ],
    "notes": ""
  }
}
