{
  "format_version": "2.0",
  "playbook": {
    "id": "hook-fix-v1",
    "plan_path": "play/hook-fix-v1/plan.json",
    "status": "active"
  },
  "active": {
    "phase": "p1",
    "subtask": "p1.1"
  },
  "phases": {
    "p1": {
      "status": "pending",
      "updated_at": ""
    },
    "p2": {
      "status": "pending",
      "updated_at": ""
    },
    "p3": {
      "status": "pending",
      "updated_at": ""
    },
    "p4": {
      "status": "pending",
      "updated_at": ""
    },
    "p5": {
      "status": "pending",
      "updated_at": ""
    },
    "p6": {
      "status": "pending",
      "updated_at": ""
    },
    "p_final": {
      "status": "pending",
      "updated_at": ""
    }
  },
  "subtasks": {
    "p1.1": {
      "status": "pending",
      "validated_at": "",
      "validated_by": "",
      "validations": {
        "technical": {
          "status": "PENDING",
          "evidence": []
        },
        "consistency": {
          "status": "PENDING",
          "evidence": []
        },
        "completeness": {
          "status": "PENDING",
          "evidence": []
        }
      },
      "notes": ""
    },
    "p2.1": {
      "status": "pending",
      "validated_at": "",
      "validated_by": "",
      "validations": {
        "technical": {
          "status": "PENDING",
          "evidence": []
        },
        "consistency": {
          "status": "PENDING",
          "evidence": []
        },
        "completeness": {
          "status": "PENDING",
          "evidence": []
        }
      },
      "notes": ""
    },
    "p3.1": {
      "status": "pending",
      "validated_at": "",
      "validated_by": "",
      "validations": {
        "technical": {
          "status": "PENDING",
          "evidence": []
        },
        "consistency": {
          "status": "PENDING",
          "evidence": []
        },
        "completeness": {
          "status": "PENDING",
          "evidence": []
        }
      },
      "notes": ""
    },
    "p4.1": {
      "status": "pending",
      "validated_at": "",
      "validated_by": "",
      "validations": {
        "technical": {
          "status": "PENDING",
          "evidence": []
        },
        "consistency": {
          "status": "PENDING",
          "evidence": []
        },
        "completeness": {
          "status": "PENDING",
          "evidence": []
        }
      },
      "notes": ""
    },
    "p5.1": {
      "status": "pending",
      "validated_at": "",
      "validated_by": "",
      "validations": {
        "technical": {
          "status": "PENDING",
          "evidence": []
        },
        "consistency": {
          "status": "PENDING",
          "evidence": []
        },
        "completeness": {
          "status": "PENDING",
          "evidence": []
        }
      },
      "notes": ""
    },
    "p6.1": {
      "status": "pending",
      "validated_at": "",
      "validated_by": "",
      "validations": {
        "technical": {
          "status": "PENDING",
          "evidence": []
        },
        "consistency": {
          "status": "PENDING",
          "evidence": []
        },
        "completeness": {
          "status": "PENDING",
          "evidence": []
        }
      },
      "notes": ""
    },
    "p6.2": {
      "status": "pending",
      "validated_at": "",
      "validated_by": "",
      "validations": {
        "technical": {
          "status": "PENDING",
          "evidence": []
        },
        "consistency": {
          "status": "PENDING",
          "evidence": []
        },
        "completeness": {
          "status": "PENDING",
          "evidence": []
        }
      },
      "notes": ""
    },
    "p_final.1": {
      "status": "pending",
      "validated_at": "",
      "validated_by": "",
      "validations": {
        "technical": {
          "status": "PENDING",
          "evidence": []
        },
        "consistency": {
          "status": "PENDING",
          "evidence": []
        },
        "completeness": {
          "status": "PENDING",
          "evidence": []
        }
      },
      "notes": ""
    }
  },
  "final_tasks": [],
  "critic": {
    "status": "PENDING",
    "evidence": [],
    "notes": ""
  }
}
